{
  "bookText": "<h1>Lorem Ipsum</h1>...Is simply <strong>dummy text</strong> of the printing and typesetting industry...",
  "authorText": "There are many variations of passages of Lorem Ipsum available.",
  "authorImage": "/v1/media/00000000000000000000000001",
  "bookImage": "/v1/media/00000000000000000000000002"
}
